{
  "collection_case_presentment_contract_version": 1,
  "collection_case_id": "019d7b92-1aa0-7a7f-b61c-962c0f4bf631",
  "tenant_reference": "urn:cwl:tenant_001",
  "invoice_draft_id": "019d7b92-1aa0-7a7f-b61c-962c0f4bf620",
  "currency_code": "USD",
  "collection_outstanding": "100.00",
  "collection_case_status": "dunning",
  "opened_at": "2026-08-17T21:00:00Z",
  "next_operator_action": "collect",
  "last_dunning_notice_code": "first_notice",
  "next_dunning_notice_code": "overdue_notice",
  "dunning_events": [
    {
      "dunning_event_id": "019d7b92-1aa0-7a7f-b61c-962c0f4bf632",
      "dunning_event_number": 1,
      "dunning_notice_code": "first_notice",
      "occurred_at": "2026-08-17T21:05:00Z"
    }
  ]
}
